v1,v2,,,
ham,"We made it! Eta at taunton is 12:30 as planned, hope thatÉ?¯???˙s still okday?! Good to see you! :-xx",,,
ham,I'm hungry buy smth home...,,,
ham,\HEY KATE," HOPE UR OK... WILL GIVE U A BUZ WEDLUNCH. GO OUTSOMEWHERE 4 ADRINK IN TOWN..CUD GO 2WATERSHD 4 A BIT? PPL FROMWRK WILL BTHERE. LOVE PETEXXX.\""""",,
ham,My drive can only be read. I need to write,,,
ham,"Just looked it up and addie goes back Monday, sucks to be her",,,
ham,Happy new year. Hope you are having a good semester,,,
ham,Esplanade lor. Where else...,,,
ham,Can you talk with me..,,,
ham,"Hmph. Go head, big baller.",,,
ham,Well its not like you actually called someone a punto. That woulda been worse.,,,
ham,"Nope. Since ayo travelled, he has forgotten his guy",,,
ham,You still around? Looking to pick up later,,,
spam,CDs 4u: Congratulations ur awarded ?ù?ú500 of CD gift vouchers or ?ù?ú125 gift guaranteed & Freeentry 2 ?ù?ú100 wkly draw xt MUSIC to 87066 TnCs www.ldew.com1win150ppmx3age16 ,,,
ham,There's someone here that has a year  &lt;#&gt;  toyota camry like mr olayiwola's own. Mileage is  &lt;#&gt; k.its clean but i need to know how much will it sell for. If i can raise the dough for it how soon after landing will it sell. Holla back.,,,
ham,Guess which pub im in? Im as happy as a pig in clover or whatever the saying is! ,,,
ham,ILL B DOWN SOON,,,
ham,Oh k. . I will come tomorrow,,,
ham,Go fool dont cheat others ok,,,
ham,"My mobile number.pls sms ur mail id.convey regards to achan,amma.Rakhesh.Qatar",,,
ham,"By the way, 'rencontre' is to meet again. Mountains dont....",,,
spam,You have WON a guaranteed ?ù?ú1000 cash or a ?ù?ú2000 prize. To claim yr prize call our customer service representative on 08714712412 between 10am-7pm Cost 10p,,,
ham,U attend ur driving lesson how many times a wk n which day?,,,
ham,"Uncle G, just checking up on you. Do have a rewarding month",,,
ham,Hello boytoy ! Geeee ... I'm missing you today. I like to send you a tm and remind you I'm thinking of you ... And you are loved ... *loving kiss*,,,
ham,I think the other two still need to get cash but we can def be ready by 9,,,
ham,Hey gals...U all wanna meet 4 dinner at n????te? ,,,
spam,Dear 0776xxxxxxx U've been invited to XCHAT. This is our final attempt to contact u! Txt CHAT to 86688 150p/MsgrcvdHG/Suite342/2Lands/Row/W1J6HL LDN 18yrs,,,
ham,Babe ! What are you doing ? Where are you ? Who are you talking to ? Do you think of me ? Are you being a good boy? Are you missing me? Do you love me ?,,,
ham,Great! How is the office today?,,,
ham,"It's cool, we can last a little while. Getting more any time soon?",,,
ham,:-( sad puppy noise,,,
ham,Yes its possible but dint try. Pls dont tell to any one k,,,
ham,Anyway holla at me whenever you're around because I need an excuse to go creep on people in sarasota,,,
ham,Where you. What happen,,,
ham,I was gonna ask you lol but i think its at 7,,,
spam,Ur cash-balance is currently 500 pounds - to maximize ur cash-in now send GO to 86688 only 150p/meg. CC: 08718720201 HG/Suite342/2lands Row/W1j6HL,,,
spam,PRIVATE! Your 2003 Account Statement for shows 800 un-redeemed S.I.M. points. Call 08715203685 Identifier Code:4xx26 Expires 13/10/04,,,
ham,Go chase after her and run her over while she's crossing the street,,,
spam,I'd like to tell you my deepest darkest fantasies. Call me 09094646631 just 60p/min. To stop texts call 08712460324 (nat rate),,,
ham,Is there coming friday is leave for pongal?do you get any news from your work place.,,,
ham,Hey... Very inconvenient for your sis a not huh?,,,
ham,Ok i vl..do u know i got adsense approved..,,,
ham,"* Was really good to see you the other day dudette, been missing you!",,,
ham,I want to go to perumbavoor,,,
ham,How many times i told in the stage all use to laugh. You not listen aha.,,,
spam,You won't believe it but it's true. It's Incredible Txts! Reply G now to learn truly amazing things that will blow your mind. From O2FWD only 18p/txt,,,
ham,(You didn't hear it from me),,,
ham,Thanks for being there for me just to talk to on saturday. You are very dear to me. I cherish having you as a brother and role model.,,,
ham,Pls clarify back if an open return ticket that i have can be preponed for me to go back to kerala.,,,
spam,Natalie (20/F) is inviting you to be her friend. Reply YES-165 or NO-165 See her: www.SMS.ac/u/natalie2k9 STOP? Send STOP FRND to 62468,,,
ham,She ran off with a younger man. we will make pretty babies together :),,,
spam,Jamster! To get your free wallpaper text HEART to 88888 now! T&C apply. 16 only. Need Help? Call 08701213186.,,,
ham,O ic lol. Should play 9 doors sometime yo,,,
ham,"Dunno, my dad said he coming home 2 bring us out 4 lunch. Yup i go w u lor. I call u when i reach school lor...",,,
ham,"We have sent JD for Customer Service cum Accounts Executive to ur mail id, For details contact us",,,
ham,Desires- u going to doctor 4 liver. And get a bit stylish. Get ur hair managed. Thats it.,,,
ham,Hmmm.still we dont have opener?,,,
ham,Yeah so basically any time next week you can get away from your mom &amp; get up before 3,,,
ham,"Edison has rightly said, \A fool can ask more questions than a wise man can answer\"" Now you know why all of us are speechless during ViVa.. GM",GN,GE,"GNT:-)"""
ham,I will vote for wherever my heart guides me,,,
ham,With my sis lor... We juz watched italian job.,,,
ham,"Tick, tick, tick .... Where are you ? I could die of loneliness you know ! *pouts* *stomps feet* I need you ...",,,
ham,Lmao you know me so well...,,,
spam,Double Mins & Double Txt & 1/2 price Linerental on Latest Orange Bluetooth mobiles. Call MobileUpd8 for the very latest offers. 08000839402 or call2optout/LF56,,,
ham,Am on a train back from northampton so i'm afraid not! I'm staying skyving off today ho ho! Will be around wednesday though. Do you fancy the comedy club this week by the way?,,,
ham,Goodnight da thangam I really miss u dear.,,,
ham,Hey next sun 1030 there's a basic yoga course... at bugis... We can go for that... Pilates intro next sat.... Tell me what time you r free,,,
ham,"Geeeee ... Your internet is really bad today, eh ?",,,
spam,Free video camera phones with Half Price line rental for 12 mths and 500 cross ntwk mins 100 txts. Call MobileUpd8 08001950382 or Call2OptOut/674,,,
ham,I think i am disturbing her da,,,
ham,"Sorry, I'll call you  later. I am in meeting sir.",,,
ham,Havent stuck at orchard in my dad's car. Going 4 dinner now. U leh? So r they free tonight?,,,
ham,Ok i also wan 2 watch e 9 pm show...,,,
ham,I dunno lei... Like dun haf...,,,
ham,But your brother transfered only  &lt;#&gt;  +  &lt;#&gt; . Pa.,,,
ham,I calls you later. Afternoon onwords mtnl service get problem in south mumbai. I can hear you but you cann't listen me.,,,
spam,83039 62735=?ù?ú450 UK Break AccommodationVouchers terms & conditions apply. 2 claim you mustprovide your claim number which is 15541 ,,,
ham,Talk to g and x about that,,,
ham,Hai dear friends... This is my new &amp; present number..:) By Rajitha Raj (Ranju),,,
spam,5p 4 alfie Moon's Children in need song on ur mob. Tell ur m8s. Txt Tone charity to 8007 for Nokias or Poly charity for polys: zed 08701417012 profit 2 charity.,,,
ham,As in different styles?,,,
spam,WIN a ?ù?ú200 Shopping spree every WEEK Starting NOW. 2 play text STORE to 88039. SkilGme. TsCs08714740323 1Winawk! age16 ?ù?ú1.50perweeksub.,,,
ham,Gud ni8 dear..slp well..take care..swt dreams..Muah..,,,
ham,I want to sent  &lt;#&gt; mesages today. Thats y. Sorry if i hurts,,,
spam,"This is the 2nd attempt to contract U, you have won this weeks top prize of either ?ù?ú1000 cash or ?ù?ú200 prize. Just call 09066361921",,,
ham,"Well, i'm glad you didn't find it totally disagreeable ... Lol",,,
ham,"Guy, no flash me now. If you go call me, call me. How madam. Take care oh.",,,
spam,Do you want a New Nokia 3510i colour phone DeliveredTomorrow? With 300 free minutes to any mobile + 100 free texts + Free Camcorder reply or call 08000930705.,,,
ham,Mark works tomorrow. He gets out at 5. His work is by your house so he can meet u afterwards.,,,
ham,\Keep ur problems in ur heart," b'coz nobody will fight for u. Only u &amp; u have to fight for ur self &amp; win the battle. -VIVEKANAND- G 9t.. SD..""",,
ham,"Yeah, give me a call if you've got a minute",,,
ham,\HI BABE UAWAKE?FEELLIKW SHIT.JUSTFOUND OUT VIA ALETTER THATMUM GOTMARRIED 4thNOV.BEHIND OURBACKS ?ù?ê FUCKINNICE!SELFISH,DEVIOUSBITCH.ANYWAY,"I?ù??L CALL U\""""",
ham,Amazing : If you rearrange these letters it gives the same meaning... Dormitory = Dirty room Astronomer = Moon starer The eyes = They see Election results = Lies lets recount Mother-in-law = Woman Hitler Eleven plus two =Twelve plus one Its Amazing... !:-),,,
ham,Aiya we discuss later lar... Pick ??_ up at 4 is it?,,,
ham,Hey happy birthday...,,,
ham,Sorry i missed your call. Can you please call back.,,,
ham,Omg if its not one thing its another. My cat has worms :/ when does this bad day end?,,,
ham,"Good morning, im suffering from fever and dysentry ..will not be able to come to office today.",,,
ham,I wont do anything de.,,,
ham,What type of stuff do you sing?,,,
ham,"St andre, virgil's cream",,,
ham,No no. I will check all rooms befor activities,,,
ham,"My fri ah... Okie lor,goin 4 my drivin den go shoppin after tt...",,,
ham,Gokila is talking with you aha:),,,
ham,"Hi Shanil,Rakhesh here.thanks,i have exchanged the uncut diamond stuff.leaving back. Excellent service by Dino and Prem.",,,
ham,K.k.this month kotees birthday know?,,,
ham,But i'm really really broke oh. No amount is too small even  &lt;#&gt; ,,,
ham,Sorry about that this is my mates phone and i didnt write it love Kate,,,
spam,"TheMob>Hit the link to get a premium Pink Panther game, the new no. 1 from Sugababes, a crazy Zebra animation or a badass Hoody wallpaper-all 4 FREE!",,,
ham,"Ah, well that confuses things, doesnt it? I thought was friends with now. Maybe i did the wrong thing but i already sort of invited -tho he may not come cos of money.",,,
ham,"Aight, call me once you're close",,,
ham,Nope thats fine. I might have a nap tho! ,,,
spam,This msg is for your mobile content order It has been resent as previous attempt failed due to network error Queries to customersqueries@netvision.uk.com,,,
ham,In other news after hassling me to get him weed for a week andres has no money. HAUGHAIGHGTUJHYGUJ,,,
ham,"A Boy loved a gal. He propsd bt she didnt mind. He gv lv lttrs, Bt her frnds threw thm. Again d boy decided 2 aproach d gal , dt time a truck was speeding towards d gal. Wn it was about 2 hit d girl,d boy ran like hell n saved her. She asked 'hw cn u run so fast?' D boy replied \Boost is d secret of my energy\"" n instantly d girl shouted \""our energy\"" n Thy lived happily 2gthr drinking boost evrydy Moral of d story:- I hv free msgs:D;): gud ni8""",,,
ham,I wnt to buy a BMW car urgently..its vry urgent.but hv a shortage of  &lt;#&gt; Lacs.there is no source to arng dis amt. &lt;#&gt; lacs..thats my prob,,,
ham,Ding me on ya break fassyole! Blacko from londn,,,
ham,I REALLY NEED 2 KISS U I MISS U MY BABY FROM UR BABY 4EVA,,,
ham,"The sign of maturity is not when we start saying big things.. But actually it is, when we start understanding small things... *HAVE A NICE EVENING* BSLVYL",,,
ham,Oh you got many responsibilities.,,,
spam,You have 1 new message. Please call 08715205273,,,
ham,I've reached sch already...,,,
spam,December only! Had your mobile 11mths+? You are entitled to update to the latest colour camera mobile for Free! Call The Mobile Update VCo FREE on 08002986906 ,,,
ham,U definitely need a module from e humanities dis sem izzit? U wan 2 take other modules 1st?,,,
ham,Argh why the fuck is nobody in town ;_;,,,
spam,"Get 3 Lions England tone, reply lionm 4 mono or lionp 4 poly. 4 more go 2 www.ringtones.co.uk, the original n best. Tones 3GBP network operator rates apply.",,,
ham,Thanks. Fills me with complete calm and reassurance! ,,,
ham,Aslamalaikkum....insha allah tohar beeen muht albi mufti mahfuuz...meaning same here....,,,
ham,Are you driving or training?,,,
ham,Lol for real. She told my dad I have cancer,,,
spam,PRIVATE! Your 2003 Account Statement for 078,,,
ham,"Oops I did have it,  &lt;#&gt; ?",,,
ham,"\NOT ENUFCREDEIT TOCALL.SHALL ILEAVE UNI AT 6 +GET A BUS TO YOR HOUSE?\""""",,,
ham,"Hi Chikku, send some nice msgs",,,
ham,"He is impossible to argue with and he always treats me like his sub, like he never released me ... Which he did and I will remind him of that if necessary",,,
ham,"After my work ah... Den 6 plus lor... U workin oso rite... Den go orchard lor, no other place to go liao...",,,
ham,"To the wonderful Okors, have a great month. We cherish you guys and wish you well each day. MojiBiola",,,
ham,Cuz ibored. And don wanna study,,,
ham,Wot about on wed nite I am 3 then but only til 9!,,,
ham,"Rose for red,red for blood,blood for heart,heart for u. But u for me.... Send tis to all ur friends.. Including me.. If u like me.. If u get back, 1-u r poor in relation! 2-u need some 1 to support 3-u r frnd 2 many 4-some1 luvs u 5+- some1 is praying god to marry u.:-) try it....",,,
ham,Any way where are you and what doing.,,,
ham,That sucks. I'll go over so u can do my hair. You'll do it free right?,,,
ham,it's still not working. And this time i also tried adding zeros. That was the savings. The checking is  &lt;#&gt; ,,,
ham,"Hmm... Dunno leh, mayb a bag 4 goigng out dat is not too small. Or jus anything except perfume, smth dat i can keep.",,,
ham,Sday only joined.so training we started today:),,,
ham,Sorry * was at the grocers.,,,
ham,There are some nice pubs near here or there is Frankie n Bennys near the warner cinema?,,,
spam,"YOU VE WON! Your 4* Costa Del Sol Holiday or ?ù?ú5000 await collection. Call 09050090044 Now toClaim. SAE, TC s, POBox334, Stockport, SK38xh, Cost?ù?ú1.50/pm, Max10mins",,,
ham,Yup... I havent been there before... You want to go for the yoga? I can call up to book ,,,
ham,Oh shut it. Omg yesterday I had a dream that I had 2 kids both boys. I was so pissed. Not only about the kids but them being boys. I even told mark in my dream that he was changing diapers cause I'm not getting owed in the face.,,,
ham,Yeah I imagine he would be really gentle. Unlike the other docs who treat their patients like turkeys.,,,
spam,FREE for 1st week! No1 Nokia tone 4 ur mobile every week just txt NOKIA to 8077 Get txting and tell ur mates. www.getzed.co.uk POBox 36504 W45WQ 16+ norm150p/tone,,,
ham,Now that you have started dont stop. Just pray for more good ideas and anything i see that can help you guys i.ll forward you a link.,,,
ham,Hi darlin im on helens fone im gonna b up the princes 2 nite please come up tb love Kate,,,
ham,I'm in office now da:)where are you?,,,
ham,Aiyar u so poor thing... I give u my support k... Jia you! I'll think of u...,,,
ham,Oh unintentionally not bad timing. Great. Fingers  the trains play along! Will give fifteen min warning.,,,
spam,Get your garden ready for summer with a FREE selection of summer bulbs and seeds worth ?ù?ú33:50 only with The Scotsman this Saturday. To stop go2 notxt.co.uk,,,
ham,K..then come wenever u lik to come and also tel vikky to come by getting free time..:-),,,
ham,Pls call me da. What happen.,,,
ham,"Happy new year to u and ur family...may this new year bring happiness , stability and tranquility to ur vibrant colourful life:):)",,,
ham,No problem with the renewal. I.ll do it right away but i dont know his details.,,,
ham,Idk. I'm sitting here in a stop and shop parking lot right now bawling my eyes out because i feel like i'm a failure in everything. Nobody wants me and now i feel like i'm failing you.,,,
ham,Haven't left yet so probably gonna be here til dinner,,,
ham,"Like  &lt;#&gt; , same question",,,
ham,MY NEW YEARS EVE WAS OK. I WENT TO A PARTY WITH MY BOYFRIEND. WHO IS THIS SI THEN HEY,,,
ham,"Sir, I need Velusamy sir's date of birth and company bank facilities details.",,,
ham,K k:) sms chat with me.,,,
ham,I will come with karnan car. Please wait till 6pm will directly goto doctor.,,,
ham,No but the bluray player can,,,
ham,Ok... Then r we meeting later?,,,
ham,Lol no. I just need to cash in my nitros. Hurry come on before I crash out!,,,
ham,Just send a text. We'll skype later.,,,
ham,Ok leave no need to ask,,,
spam,"Congrats 2 mobile 3G Videophones R yours. call 09063458130 now! videochat wid ur mates, play java games, Dload polypH music, noline rentl. bx420. ip4. 5we. 150p",,,
ham,???è still got lessons?  ???è in sch?,,,
ham,Y she dun believe leh? I tot i told her it's true already. I thk she muz c us tog then she believe.,,,
ham,Oh did you charge camera,,,
ham,"IÉ?¯???˙ve got some salt, you can rub it in my open wounds if you like!",,,
ham,Now i'm going for lunch.,,,
ham,I'm in school now n i'll be in da lab doing some stuff give me a call when ??_ r done.,,,
ham,Oh k. . I will come tomorrow,,,
ham,"Aight, text me tonight and we'll see what's up",,,
ham,U 2.,,,
ham,Water logging in desert. Geoenvironmental implications.,,,
ham,Raji..pls do me a favour. Pls convey my Birthday wishes to Nimya. Pls. Today is her birthday.,,,
ham,Company is very good.environment is terrific and food is really nice:),,,
ham,"Very strange.  and  are watching the 2nd one now but i'm in bed. Sweet dreams, miss u ",,,
spam,SMS AUCTION - A BRAND NEW Nokia 7250 is up 4 auction today! Auction is FREE 2 join & take part! Txt NOKIA to 86021 now!,,,
ham,"Hi hope u r both ok, he said he would text and he hasn't, have u seen him, let me down gently please ",,,
ham,"Babe! I fucking love you too !! You know? Fuck it was so good to hear your voice. I so need that. I crave it. I can't get enough. I adore you, Ahmad *kisses*",,,
ham,K sure am in my relatives home. Sms me de. Pls:-),,,
ham,I sent them. Do you like?,,,
ham,"Fuuuuck I need to stop sleepin, sup",,,
ham,I'm in town now so i'll jus take mrt down later.,,,
ham,I just cooked a rather nice salmon a la you,,,
ham,I uploaded mine to Facebook,,,
ham,WHAT TIME U WRKIN?,,,
ham,Okie,,,
spam,ree entry in 2 a weekly comp for a chance to win an ipod. Txt POD to 80182 to get entry (std txt rate) T&C's apply 08452810073 for details 18+,,,
spam,Our records indicate u maybe entitled to 5000 pounds in compensation for the Accident you had. To claim 4 free reply with CLAIM to this msg. 2 stop txt STOP,,,
ham,"Sorry, I'll call later",,,
ham,Oh oh... Den muz change plan liao... Go back have to yan jiu again...,,,
ham,"It's wylie, you in tampa or sarasota?",,,
ham,Ok... Take ur time n enjoy ur dinner...,,,
ham,Darren was saying dat if u meeting da ge den we dun meet 4 dinner. Cos later u leave xy will feel awkward. Den u meet him 4 lunch lor.,,,
spam,"Spook up your mob with a Halloween collection of a logo & pic message plus a free eerie tone, txt CARD SPOOK to 8007 zed 08701417012150p per logo/pic ",,,
ham,I like cheap! But iÉ?¯???˙m happy to splash out on the wine if it makes you feel better..,,,
ham,She.s fine. I have had difficulties with her phone. It works with mine. Can you pls send her another friend request.,,,
ham,Ugh my leg hurts. Musta overdid it on mon.,,,
spam,Call Germany for only 1 pence per minute! Call from a fixed line via access number 0844 861 85 85. No prepayment. Direct access! www.telediscount.co.uk,,,
spam,"YOU VE WON! Your 4* Costa Del Sol Holiday or ?ù?ú5000 await collection. Call 09050090044 Now toClaim. SAE, TC s, POBox334, Stockport, SK38xh, Cost?ù?ú1.50/pm, Max10mins",,,
ham,WOT STUDENT DISCOUNT CAN U GET ON BOOKS?,,,
ham,Me fine..absolutly fine,,,
ham,How come she can get it? Should b quite diff to guess rite...,,,
spam,Had your mobile 11mths ? Update for FREE to Oranges latest colour camera mobiles & unlimited weekend calls. Call Mobile Upd8 on freefone 08000839402 or 2StopTxt,,,
ham,I will reach ur home in  &lt;#&gt;  minutes,,,
ham,"Babe, I'm answering you, can't you see me ? Maybe you'd better reboot YM ... I got the photo ... It's great !",,,
ham,Hi.what you think about match?,,,
ham,"I know you are thinkin malaria. But relax, children cant handle malaria. She would have been worse and its gastroenteritis. If she takes enough to replace her loss her temp will reduce. And if you give her malaria meds now she will just vomit. Its a self limiting illness she has which means in a few days it will completely stop",,,
ham,Dai i downloaded but there is only exe file which i can only run that exe after installing.,,,
ham,It is only yesterday true true.,,,
ham,K.k.how is your business now?,,,
ham,3 pa but not selected.,,,
spam,Natalja (25/F) is inviting you to be her friend. Reply YES-440 or NO-440 See her: www.SMS.ac/u/nat27081980 STOP? Send STOP FRND to 62468,,,
ham,I keep ten rs in my shelf:) buy two egg.,,,
ham,I am late. I will be there at,,,
ham,Well thats nice. Too bad i cant eat it,,,
ham,I accidentally brought em home in the box,,,
ham,Pls she needs to dat slowly or she will vomit more.,,,
ham,I have to take exam with in march 3,,,
ham,"Jane babes not goin 2 wrk, feel ill after lst nite. Foned in already cover 4 me chuck.:-)",,,
ham,5 nights...We nt staying at port step liao...Too ex,,,
ham,If I die I want u to have all my stuffs.,,,
ham,"\OH FUCK. JUSWOKE UP IN A BED ON A BOATIN THE DOCKS. SLEPT WID 25 YEAR OLD. SPINOUT! GIV U DA GOSSIP L8R. XXX\""""",,,
ham,Smile in Pleasure Smile in Pain Smile when trouble pours like Rain Smile when sum1 Hurts U Smile becoz SOMEONE still Loves to see u Smiling!!,,,
ham,Prabha..i'm soryda..realy..frm heart i'm sory,,,
ham,I re-met alex nichols from middle school and it turns out he's dealing!,,,
spam,PRIVATE! Your 2003 Account Statement for <fone no> shows 800 un-redeemed S. I. M. points. Call 08715203656 Identifier Code: 42049 Expires 26/10/04,,,
ham,It means u could not keep ur words.,,,
ham,"Nope, I'm still in the market",,,
ham,I realise you are a busy guy and i'm trying not to be a bother. I have to get some exams outta the way and then try the cars. Do have a gr8 day,,,
spam,YOU ARE CHOSEN TO RECEIVE A ?ù?ú350 AWARD! Pls call claim number 09066364311 to collect your award which you are selected to receive as a valued mobile customer.,,,
ham,Hey what how about your project. Started aha da.,,,
ham,Ok cool. See ya then.,,,
ham,Am on the uworld site. Am i buying the qbank only or am i buying it with the self assessment also?,,,
ham,Your opinion about me? 1. Over 2. Jada 3. Kusruthi 4. Lovable 5. Silent 6. Spl character 7. Not matured 8. Stylish 9. Simple Pls reply..,,,
spam,Someonone you know is trying to contact you via our dating service! To find out who it could be call from your mobile or landline 09064015307 BOX334SK38ch ,,,
ham,Yeah I can still give you a ride,,,
ham,"Jay wants to work out first, how's 4 sound?",,,
ham,"Gud gud..k, chikku tke care.. sleep well gud nyt",,,
ham,Its a part of checking IQ,,,
ham,Hmm thinking lor...,,,
ham,Of course ! Don't tease me ... You know I simply must see ! *grins* ... Do keep me posted my prey ... *loving smile* *devouring kiss*,,,
ham,thanks for the temales it was wonderful. Thank. Have a great week.,,,
ham,Thank you princess! I want to see your nice juicy booty...,,,
ham,Haven't eaten all day. I'm sitting here staring at this juicy pizza and I can't eat it. These meds are ruining my life.,,,
ham,Gud ni8 dear..slp well..take care..swt dreams..Muah..,,,
ham,U come n search tat vid..not finishd..,,,
ham,"K I'm leaving soon, be there a little after 9",,,
spam,Urgent! Please call 09061213237 from a landline. ?ù?ú5000 cash or a 4* holiday await collection. T &Cs SAE PO Box 177 M227XY. 16+,,,
ham,"Yeah work is fine, started last week, all the same stuff as before, dull but easy and guys are fun!",,,
ham,You do your studies alone without anyones help. If you cant no need to study.,,,
ham,Please tell me not all of my car keys are in your purse,,,
ham,I didnt get anything da,,,
ham,Ok... Sweet dreams...,,,
ham,Well she's in for a big surprise!,,,
ham,"As usual..iam fine, happy &amp; doing well..:)",,,
ham,1 in cbe. 2 in chennai.,,,
ham,Can help u swoop by picking u up from wherever ur other birds r meeting if u want.,,,
ham,If anyone calls for a treadmill say you'll buy it. Make sure its working. I found an ad on Craigslist selling for $ &lt;#&gt; .,,,
ham,I absolutely LOVE South Park! I only recently started watching the office.,,,
ham,Did you see that film:),,,
ham,Pls speak with me. I wont ask anything other then you friendship.,,,
ham,"Storming msg: Wen u lift d phne, u say \HELLO\"" Do u knw wt is d real meaning of HELLO?? . . . It's d name of a girl..! . . . Yes.. And u knw who is dat girl?? \""Margaret Hello\"" She is d girlfrnd f Grahmbell who invnted telphone... . . . . Moral:One can 4get d name of a person"," bt not his girlfrnd... G o o d n i g h t . . .@""",,
ham,Gud ni8.swt drms.take care,,,
ham,HI DARLIN ITS KATE ARE U UP FOR DOIN SOMETHIN TONIGHT? IM GOING TO A PUB CALLED THE SWAN OR SOMETHING WITH MY PARENTS FOR ONE DRINK SO PHONE ME IF U CAN,,,
ham,Anything lar then ??_ not going home 4 dinner?,,,
ham,\ER," ENJOYIN INDIANS AT THE MO..yeP. SaLL gOoD HehE ;> hows bout u shexy? Pete Xx\""""",,
spam,"If you don't, your prize will go to another customer. T&C at www.t-c.biz 18+ 150p/min Polo Ltd Suite 373 London W1J 6HL Please call back if busy ",,,
ham,Did u fix the teeth?if not do it asap.ok take care.,,,
ham,So u wan 2 come for our dinner tonight a not?,,,
ham,"Hello.How u doing?What u been up 2?When will u b moving out of the flat, cos I will need to arrange to pick up the lamp, etc. Take care. Hello caroline!",,,
ham,Its too late:)but its k.wish you the same.,,,
